<?xml version="1.0" encoding="UTF-8"?>
<tns:simulation xmlns:tns="http://www.openworm.org/simulationSchema" xmlns:xsi="http://www.w3.org/2001/XMLSchema-instance" xsi:schemaLocation="../../main/resources/schema/simulationSchema.xsd">
 
	<tns:entity>
		<tns:id>hhcell</tns:id>
		<tns:aspect>
			<tns:id>electrical</tns:id>
			<tns:model>
    				<tns:modelInterpreterId>lemsModelInterpreter</tns:modelInterpreterId>
    				<tns:modelURL>https://raw.github.com/openworm/org.geppetto.samples/master/LEMS/SingleComponentHH/LEMS_NML2_Ex5_DetCell.xml</tns:modelURL>
			</tns:model>
		</tns:aspect>		
	</tns:entity>
	
</tns:simulation>
